{
  "schema_version": 1,
  "kind": "session",
  "session": {
    "session_id": "e2e-seed-history",
    "status": "completed",
    "started_at": "2026-09-20T12:00:00Z",
    "ended_at": "2026-09-20T12:01:00Z",
    "duration_ms": 60000,
    "coverage_tier": "B",
    "cpu_vendor": "intel",
    "cpu_model": "Seed CPU (e2e history)",
    "topology": "8t/4c",
    "ruleset_version": "ruleset-v1"
  },
  "samples": [
    {
      "timestamp_utc": "2026-09-20T12:00:00.000Z",
      "monotonic_ms": 0,
      "sensor_id": "cpu.package.load",
      "metric": "load",
      "scope": "package",
      "value": 30,
      "boolean": null,
      "status": "ok",
      "quality": "direct"
    },
    {
      "timestamp_utc": "2026-09-20T12:00:00.000Z",
      "monotonic_ms": 0,
      "sensor_id": "cpu.package.temp",
      "metric": "temperature",
      "scope": "package",
      "value": 58,
      "boolean": null,
      "status": "ok",
      "quality": "direct"
    },
    {
      "timestamp_utc": "2026-09-20T12:00:00.000Z",
      "monotonic_ms": 0,
      "sensor_id": "cpu.package.power",
      "metric": "power",
      "scope": "package",
      "value": 22,
      "boolean": null,
      "status": "ok",
      "quality": "direct"
    },
    {
      "timestamp_utc": "2026-09-20T12:00:05.000Z",
      "monotonic_ms": 5000,
      "sensor_id": "cpu.package.load",
      "metric": "load",
      "scope": "package",
      "value": 39.6,
      "boolean": null,
      "status": "ok",
      "quality": "direct"
    },
    {
      "timestamp_utc": "2026-09-20T12:00:05.000Z",
      "monotonic_ms": 5000,
      "sensor_id": "cpu.package.temp",
      "metric": "temperature",
      "scope": "package",
      "value": 60.9,
      "boolean": null,
      "status": "ok",
      "quality": "direct"
    },
    {
      "timestamp_utc": "2026-09-20T12:00:05.000Z",
      "monotonic_ms": 5000,
      "sensor_id": "cpu.package.power",
      "metric": "power",
      "scope": "package",
      "value": 25.8,
      "boolean": null,
      "status": "ok",
      "quality": "direct"
    },
    {
      "timestamp_utc": "2026-09-20T12:00:10.000Z",
      "monotonic_ms": 10000,
      "sensor_id": "cpu.package.load",
      "metric": "load",
      "scope": "package",
      "value": 46.8,
      "boolean": null,
      "status": "ok",
      "quality": "direct"
    },
    {
      "timestamp_utc": "2026-09-20T12:00:10.000Z",
      "monotonic_ms": 10000,
      "sensor_id": "cpu.package.temp",
      "metric": "temperature",
      "scope": "package",
      "value": 63,
      "boolean": null,
      "status": "ok",
      "quality": "direct"
    },
    {
      "timestamp_utc": "2026-09-20T12:00:10.000Z",
      "monotonic_ms": 10000,
      "sensor_id": "cpu.package.power",
      "metric": "power",
      "scope": "package",
      "value": 28.7,
      "boolean": null,
      "status": "ok",
      "quality": "direct"
    },
    {
      "timestamp_utc": "2026-09-20T12:00:15.000Z",
      "monotonic_ms": 15000,
      "sensor_id": "cpu.package.load",
      "metric": "load",
      "scope": "package",
      "value": 49.9,
      "boolean": null,
      "status": "ok",
      "quality": "direct"
    },
    {
      "timestamp_utc": "2026-09-20T12:00:15.000Z",
      "monotonic_ms": 15000,
      "sensor_id": "cpu.package.temp",
      "metric": "temperature",
      "scope": "package",
      "value": 64,
      "boolean": null,
      "status": "ok",
      "quality": "direct"
    },
    {
      "timestamp_utc": "2026-09-20T12:00:15.000Z",
      "monotonic_ms": 15000,
      "sensor_id": "cpu.package.power",
      "metric": "power",
      "scope": "package",
      "value": 30,
      "boolean": null,
      "status": "ok",
      "quality": "direct"
    },
    {
      "timestamp_utc": "2026-09-20T12:00:20.000Z",
      "monotonic_ms": 20000,
      "sensor_id": "cpu.package.load",
      "metric": "load",
      "scope": "package",
      "value": 48.2,
      "boolean": null,
      "status": "ok",
      "quality": "direct"
    },
    {
      "timestamp_utc": "2026-09-20T12:00:20.000Z",
      "monotonic_ms": 20000,
      "sensor_id": "cpu.package.temp",
      "metric": "temperature",
      "scope": "package",
      "value": 63.5,
      "boolean": null,
      "status": "ok",
      "quality": "direct"
    },
    {
      "timestamp_utc": "2026-09-20T12:00:20.000Z",
      "monotonic_ms": 20000,
      "sensor_id": "cpu.package.power",
      "metric": "power",
      "scope": "package",
      "value": 29.3,
      "boolean": null,
      "status": "ok",
      "quality": "direct"
    },
    {
      "timestamp_utc": "2026-09-20T12:00:25.000Z",
      "monotonic_ms": 25000,
      "sensor_id": "cpu.package.load",
      "metric": "load",
      "scope": "package",
      "value": 42,
      "boolean": null,
      "status": "ok",
      "quality": "direct"
    },
    {
      "timestamp_utc": "2026-09-20T12:00:25.000Z",
      "monotonic_ms": 25000,
      "sensor_id": "cpu.package.temp",
      "metric": "temperature",
      "scope": "package",
      "value": 61.6,
      "boolean": null,
      "status": "ok",
      "quality": "direct"
    },
    {
      "timestamp_utc": "2026-09-20T12:00:25.000Z",
      "monotonic_ms": 25000,
      "sensor_id": "cpu.package.power",
      "metric": "power",
      "scope": "package",
      "value": 26.8,
      "boolean": null,
      "status": "ok",
      "quality": "direct"
    },
    {
      "timestamp_utc": "2026-09-20T12:00:30.000Z",
      "monotonic_ms": 30000,
      "sensor_id": "cpu.package.load",
      "metric": "load",
      "scope": "package",
      "value": 32.8,
      "boolean": null,
      "status": "ok",
      "quality": "direct"
    },
    {
      "timestamp_utc": "2026-09-20T12:00:30.000Z",
      "monotonic_ms": 30000,
      "sensor_id": "cpu.package.temp",
      "metric": "temperature",
      "scope": "package",
      "value": 58.8,
      "boolean": null,
      "status": "ok",
      "quality": "direct"
    },
    {
      "timestamp_utc": "2026-09-20T12:00:30.000Z",
      "monotonic_ms": 30000,
      "sensor_id": "cpu.package.power",
      "metric": "power",
      "scope": "package",
      "value": 23.1,
      "boolean": null,
      "status": "ok",
      "quality": "direct"
    },
    {
      "timestamp_utc": "2026-09-20T12:00:35.000Z",
      "monotonic_ms": 35000,
      "sensor_id": "cpu.package.load",
      "metric": "load",
      "scope": "package",
      "value": 23,
      "boolean": null,
      "status": "ok",
      "quality": "direct"
    },
    {
      "timestamp_utc": "2026-09-20T12:00:35.000Z",
      "monotonic_ms": 35000,
      "sensor_id": "cpu.package.temp",
      "metric": "temperature",
      "scope": "package",
      "value": 55.9,
      "boolean": null,
      "status": "ok",
      "quality": "direct"
    },
    {
      "timestamp_utc": "2026-09-20T12:00:35.000Z",
      "monotonic_ms": 35000,
      "sensor_id": "cpu.package.power",
      "metric": "power",
      "scope": "package",
      "value": 19.2,
      "boolean": null,
      "status": "ok",
      "quality": "direct"
    },
    {
      "timestamp_utc": "2026-09-20T12:00:40.000Z",
      "monotonic_ms": 40000,
      "sensor_id": "cpu.package.load",
      "metric": "load",
      "scope": "package",
      "value": 14.9,
      "boolean": null,
      "status": "ok",
      "quality": "direct"
    },
    {
      "timestamp_utc": "2026-09-20T12:00:40.000Z",
      "monotonic_ms": 40000,
      "sensor_id": "cpu.package.temp",
      "metric": "temperature",
      "scope": "package",
      "value": 53.5,
      "boolean": null,
      "status": "ok",
      "quality": "direct"
    },
    {
      "timestamp_utc": "2026-09-20T12:00:40.000Z",
      "monotonic_ms": 40000,
      "sensor_id": "cpu.package.power",
      "metric": "power",
      "scope": "package",
      "value": 15.9,
      "boolean": null,
      "status": "ok",
      "quality": "direct"
    },
    {
      "timestamp_utc": "2026-09-20T12:00:45.000Z",
      "monotonic_ms": 45000,
      "sensor_id": "cpu.package.load",
      "metric": "load",
      "scope": "package",
      "value": 10.4,
      "boolean": null,
      "status": "ok",
      "quality": "direct"
    },
    {
      "timestamp_utc": "2026-09-20T12:00:45.000Z",
      "monotonic_ms": 45000,
      "sensor_id": "cpu.package.temp",
      "metric": "temperature",
      "scope": "package",
      "value": 52.1,
      "boolean": null,
      "status": "ok",
      "quality": "direct"
    },
    {
      "timestamp_utc": "2026-09-20T12:00:45.000Z",
      "monotonic_ms": 45000,
      "sensor_id": "cpu.package.power",
      "metric": "power",
      "scope": "package",
      "value": 14.2,
      "boolean": null,
      "status": "ok",
      "quality": "direct"
    },
    {
      "timestamp_utc": "2026-09-20T12:00:50.000Z",
      "monotonic_ms": 50000,
      "sensor_id": "cpu.package.load",
      "metric": "load",
      "scope": "package",
      "value": 10.8,
      "boolean": null,
      "status": "ok",
      "quality": "direct"
    },
    {
      "timestamp_utc": "2026-09-20T12:00:50.000Z",
      "monotonic_ms": 50000,
      "sensor_id": "cpu.package.temp",
      "metric": "temperature",
      "scope": "package",
      "value": 52.2,
      "boolean": null,
      "status": "ok",
      "quality": "direct"
    },
    {
      "timestamp_utc": "2026-09-20T12:00:50.000Z",
      "monotonic_ms": 50000,
      "sensor_id": "cpu.package.power",
      "metric": "power",
      "scope": "package",
      "value": 14.3,
      "boolean": null,
      "status": "ok",
      "quality": "direct"
    },
    {
      "timestamp_utc": "2026-09-20T12:00:55.000Z",
      "monotonic_ms": 55000,
      "sensor_id": "cpu.package.load",
      "metric": "load",
      "scope": "package",
      "value": 15.9,
      "boolean": null,
      "status": "ok",
      "quality": "direct"
    },
    {
      "timestamp_utc": "2026-09-20T12:00:55.000Z",
      "monotonic_ms": 55000,
      "sensor_id": "cpu.package.temp",
      "metric": "temperature",
      "scope": "package",
      "value": 53.8,